<?xml version="1.0" encoding="UTF-8"?>
<xs:schema elementFormDefault="qualified"
           xmlns:xs="http://www.w3.org/2001/XMLSchema">
    <xs:element name="selector">
        <xs:complexType>
            <xs:simpleContent>
                <xs:extension base="xs:string">
                    <xs:attribute type="xs:string" name="type" use="optional"/>
                </xs:extension>
            </xs:simpleContent>
        </xs:complexType>
    </xs:element>
    <xs:element name="classes">
        <xs:complexType>
            <xs:sequence>
                <xs:element ref="selector" maxOccurs="unbounded" minOccurs="1"/>
            </xs:sequence>
        </xs:complexType>
    </xs:element>
    <xs:element name="excluding">
        <xs:complexType>
            <xs:sequence>
                <xs:element ref="selector" maxOccurs="unbounded" minOccurs="1"/>
            </xs:sequence>
        </xs:complexType>
    </xs:element>
    <xs:element name="assert" type="xs:string">
    </xs:element>
    <xs:element name="rule">
        <xs:complexType>
            <xs:sequence>
                <xs:element ref="classes"/>
                <xs:element ref="excluding" minOccurs="0"/>
                <xs:element ref="assert"/>
                <xs:element ref="classes"/>
                <xs:element ref="excluding" minOccurs="0"/>
            </xs:sequence>
            <xs:attribute type="xs:string" name="name" use="required"/>
        </xs:complexType>
    </xs:element>
    <xs:element name="test">
        <xs:complexType>
            <xs:sequence>
                <xs:element ref="rule" maxOccurs="unbounded"/>
            </xs:sequence>
        </xs:complexType>
    </xs:element>
</xs:schema>