<?xml version="1.0" encoding="UTF-8" ?>
<test xmlns:xsi="http://www.w3.org/2001/XMLSchema-instance"
       xsi:schemaLocation="https://raw.githubusercontent.com/carlosas/phpat/master/YAML/src/Test/Test.xsd">
    <rule name="testAssertionsImplementAssertionInterface">
        <classes>
            <selector type="havePath">Rule/Assertion/*</selector>
        </classes>
        <excluding>
            <selector type="haveClassName">PHPat\Rule\Assertion\*\MustNot*</selector>
            <selector type="havePath">Rule/Assertion/MatchResult.php</selector>
            <selector type="havePath">Rule/Assertion/AbstractAssertion.php</selector>
        </excluding>
        <assert>mustExtend</assert>
        <classes>
            <selector type="haveClassName">PHPat\Rule\Assertion\AbstractAssertion</selector>
        </classes>
    </rule>
    <rule name="testAssertionsDoNotDependOnVendors">
        <classes>
            <selector type="havePath">Rule/Assertion/*</selector>
        </classes>
        <assert>canOnlyDependOn</assert>
        <classes>
            <selector type="haveClassName">PHPat\*</selector>
            <selector type="haveClassName">Psr\*</selector>
        </classes>
    </rule>
</test>